{
  "api_version": "codexploit/v1",
  "scope": {
    "project_id": "proj-example",
    "source_id": "src-example",
    "snapshot_id": "snap-example"
  },
  "source_revision": "content:example",
  "content_digest": "2222222222222222222222222222222222222222222222222222222222222222",
  "state": "ready",
  "created_at": "2026-10-17T04:00:00Z",
  "tree": {
    "id": "artifact-example",
    "kind": "source.snapshot",
    "scope": {
      "project_id": "proj-example",
      "source_id": "src-example",
      "snapshot_id": "snap-example"
    },
    "sha256": "1111111111111111111111111111111111111111111111111111111111111111",
    "bytes": 128,
    "media_type": "application/vnd.codexploit.snapshot+tar",
    "schema_id": "https://codexploit.invalid/contracts/v1/snapshot.schema.json",
    "producer": {
      "plugin_id": "team.scanner.example",
      "plugin_version": "1.0.0",
      "invocation_id": "invoke-example",
      "task_id": "task-example",
      "config_digest": "0000000000000000000000000000000000000000000000000000000000000000"
    }
  },
  "coverage": {
    "files_seen": 2,
    "files_analyzed": 1,
    "files_skipped": 1,
    "limitations": [
      "Example: one unsupported file was skipped."
    ]
  }
}
